{"ai":{"bundleManifestSchema":"inspectescrow.model-bundle-manifest/1.0.0","bundleMustCommit":["weights-or-pretrained-backbone-identifier","patchcore-memory-bank","backbone-and-feature-layers","coreset-and-neighbor-configuration","preprocessing-and-roi","score-normalization","postprocessing","software-container-and-dependency-lock","precision-and-determinism-profile","calibration-manifest-and-threshold-report"],"calibrationManifestHash":"0x8efbac3c1fa9dfa7b557222714dc7765c6c5367ea45da55c96e7db505be5dfce","calibrationSelectionRule":{"primary":"maximize Youden J","tie_break_1":"higher anomaly recall","tie_break_2":"lower threshold"},"method":"PatchCore","modelBundleHash":"0x64f3359a4e9a276a5f0abef0e5305f42b513dbae1ac5698cb08c9e066962383e","replayToleranceScaled":222,"requiredViewAggregation":"SINGLE_SOURCE_VIEW_RAW_PATCHCORE_SCORE","scoreMaximumScaled":"340282366920938463463374607431768211455","scoreMinimumScaled":0,"scoreNormalization":"NONE","scoreRangeJsonEncoding":"UINT128_MAX_AS_EXACT_DECIMAL_STRING_FOR_RFC8785","scoreScaleExponent":6,"scoreSchemaId":"0xcf1476a2ae70ac5fad6ba79a7f55bab4b4c4973dd892d65de9a887bf08d1f1f8","scoreSchemaName":"PATCHCORE_AGGREGATE_SCORE_V1","scoreTransformingPostprocessing":"NONE","semanticLimit":"ADMISSIBLE_REVIEW_IS_NOT_AUTOMATIC_PROOF_OF_DEFECT","stationVerdictAuthoritative":false,"thresholdScaled":57904037,"thresholdSource":"FROZEN_VALIDATION_CALIBRATION_MANIFEST","verdictRule":"CONTRACT_DERIVES_PASS_IF_SCORE_LT_THRESHOLD_ELSE_REVIEW"},"attestation":{"callerSignerSeparation":{"buyerInspection":"BUYER_ACTOR_CALLS_BUYER_STATION_SIGNS","replayAndInspector":"ACTIVE_INSPECTOR_ACTOR_CALLS_INSPECTOR_STATION_SIGNS","supplierInspection":"SUPPLIER_ACTOR_CALLS_SUPPLIER_STATION_SIGNS"},"domain":{"chainId":11155111,"verifyingContract":"0x270e3E8a53dC50A04f0d83b5b4ae9416EB42fFa9"},"notClaimed":["trustless-ai-execution","blockchain-proves-ai-correctness","model-hash-proves-execution","physical-truth-proof","zkml-proof","tee-proof"],"signatureFormat":"EIP712","stationMustSign":["tradeId","role","station","attempt","sessionNonce","policyHash","modelBundleHash","captureProfileHash","specimenManifestHash","evidencePackageHash","aggregateScoreScaled","scoreSchemaId","inspectionValidity","invalidReason","issuedAt","validUntil"],"trustModel":"TRUSTED_STATION_ATTESTATION_PLUS_INDEPENDENT_REPLAY"},"capture":{"arbitraryDistanceOrImageCount":"NOT_FROZEN","captureProfileHash":"0x3ea93a717cf8570d9b5c0662b1d27bb4a882651784342013786266b269db96da","captureProfileVersion":1,"humidity":"REMOVED_FROM_DEFAULT_MVP","lux":"NO_INDEPENDENT_VALIDITY_RULE_UNLESS_VALIDATED","numericToleranceRule":"PROMOTE_ONLY_AFTER_SENSITIVITY_EXPERIMENT_SHOWS_MATERIAL_SCORE_EFFECT","physicalCameraMetadataClaimed":false,"productionCaptureProfileClaimed":false,"profileCommits":["fixture-status","product-orientation-status","required-view-definition","background-status","lighting-metadata-status","camera-lens-acquisition-status","exposure-white-balance-status","roi-and-mask","focus-blur-saturation-qa","image-schema","capture-session-rules"],"requiredViewCount":1,"requiredViewSetHash":"0x5db9617738ccb9a0b2811e49716ad46cb24474d56a9cd55867df831a01c4abc3","temperature":"REMOVED_FROM_DEFAULT_MVP"},"evidence":{"allAttemptsRetained":true,"hashDoesNotGuaranteeAvailability":true,"identifierBearingOverviewRequired":false,"offchainStorage":"MVP_OFFCHAIN_PROJECT_ARTIFACT_STORAGE","packageCanonicalization":"RFC8785-JCS","packageHashAlgorithm":"keccak256","packageHashRule":"ZERO_ATTESTATION_DIGEST_PREIMAGE_V1","packageSchema":"inspectescrow.evidence-package/1.0.0","physicalOriginGuaranteedByHash":false,"requiredItems":["trade-and-public-dataset-source-identity-claim","exact-source-inspection-image","all-required-views","complete-session-file-list","capture-metadata-and-qa-results","policy-model-capture-hashes","per-view-and-aggregate-scaled-scores","inference-report","station-attestation-digest"]},"future":{"productionCaptureProfile":"FUTURE_VALIDATION_REQUIRED","productionPhysicalIdentifierBinding":"REQUIRED_FOR_PRODUCTION_PROFILE","tokenClaimsForbidden":["PRICE_APPRECIATION_GUARANTEE","LISTING_GUARANTEE","INVESTMENT_RETURN_GUARANTEE","FIAT_VALUE_GUARANTEE","FINANCIAL_PRODUCT_CLAIM"],"tokenRoadmap":["MVP_SEPOLIA_TEST_ASSET","MULTI_COMPANY_INSPECTOR_NETWORK","TOKENIZED_SETTLEMENT_ECOSYSTEM"],"trustedDeviceOrTee":"FUTURE_ONLY","zkml":"FUTURE_ONLY"},"hashing":{"canonicalization":"RFC8785-JCS","hashAlgorithm":"keccak256","integrationClarificationHash":"0xd3c64c3e2c6f6d5123b97a949e9b4b996494e6d8281194814ba4a45d027de76b","policyHash":"0x0000000000000000000000000000000000000000000000000000000000000000","policyHashRule":"ZERO_POLICY_HASH_PREIMAGE_V1"},"policyId":"0x94f9b3919df10d0bba367041f4c2bd2b69cf0a1c6a45417be4fe11f4d82b8337","policyVersion":1,"procedure":{"buyerInspectionTiming":"AFTER_SUPPLIER_PASS_WITHIN_CONTRACT_WINDOW","effectiveMaximumBuyerSubmissions":2,"effectiveMaximumSupplierSubmissions":2,"maxBuyerRetries":1,"maxSupplierRetries":1,"productionSlaClaimed":false,"scoreShoppingRecaptureAllowed":false,"supplierInspectionTiming":"BEFORE_SHIPMENT","windowSemantics":"DURATIONS_NOT_ABSOLUTE_TIMESTAMPS","windowsSeconds":{"backupInspector":3600,"buyerAcceptance":1800,"buyerInspection":3600,"primaryInspector":3600,"supplierInspection":3600}},"product":{"datasetAnomalyLabelsAreContractDefects":false,"lotIdentityScheme":"PUBLIC_DATASET_SIMULATION_NOT_PHYSICAL_LOT","productClass":"MVTec AD / metal_nut","productRevision":"PUBLIC_DATASET_SIMULATION_V1","productSpecificationHash":"0x68e3eb25a12d6521ae2aa37735ffad831810f6a05268d940b33a3bae6915d4e7","productionSpecificationClaimed":false,"specimenIdentity":{"bindTradeId":true,"canonicalSpecimenManifestRequired":true,"captureSessionNonceRequired":true,"claimLimit":"STRENGTHENS_TRACEABILITY_BUT_DOES_NOT_PREVENT_PHYSICAL_SUBSTITUTION","completeSessionFileListRequired":true,"identifierRequiredInOverviewImage":false,"physicalCustodyProofClaimed":false,"requiredViewSetHash":"0x5db9617738ccb9a0b2811e49716ad46cb24474d56a9cd55867df831a01c4abc3","samePhysicalSupplierBuyerItemClaimed":false,"scheme":"PUBLIC_DATASET_SOURCE_FILE_BINDING","specimenIdFormat":"DATASET_RELATIVE_PATH_PLUS_EXACT_SOURCE_DIGEST"}},"protocol":{"inspectionInvalid":{"effect":"RECORD_INVALID_ATTEMPT_AND_ROUTE_TO_REINSPECTION","examples":["REQUIRED_VIEW_MISSING","IMAGE_QA_FAILED","CAPTURE_PROFILE_NONCONFORMING","SPECIMEN_EVIDENCE_INSUFFICIENT","RECAPTURE_RULE_VIOLATION","EVIDENCE_PACKAGE_INCOMPLETE"],"invalidScoreSentinel":0,"qualityVerdict":false},"protocolRejected":{"effect":"EVM_REVERT_NO_INSPECTION_RECORD_NO_ATTEMPT_CONSUMPTION","examples":["UNAUTHORIZED_CALLER_OR_STATION","WRONG_ROLE_TRADE_OR_STATE","REUSED_NONCE","WRONG_POLICY_MODEL_CAPTURE_OR_SCORE_SCHEMA","EXPIRED_OR_FUTURE_ATTESTATION","FORBIDDEN_DUPLICATE","SCORE_OUT_OF_PROTOCOL_RANGE"]}},"replay":{"consistencyRule":{"decision":"CONTRACT_DERIVED_PASS_REVIEW_MUST_REMAIN_UNCHANGED","numeric":"ABS_REPLAY_SCALED_MINUS_SUBMITTED_SCALED_LE_222"},"cpuVsTeslaT4DemoEnvelopeVerified":true,"crossMachineVerified":false,"inputs":["exact-original-image-bytes","same-model-bundle","same-preprocessing","same-score-schema"],"outsideToleranceOrDecisionFlip":"EXECUTION_INCONSISTENT_NOT_DIRECT_QUALITY_VERDICT","replayReportHashRequired":true,"replayToleranceScaled":222,"requiredOnDisputeOrAudit":true,"universalHardwareGuarantee":false},"schema":"inspectescrow.inspection-policy","schemaVersion":"1.1.0","settlement":{"allowedFinalOutcomes":["RELEASE_TO_SUPPLIER","REFUND_TO_BUYER"],"buyerNoInspectionAutoRelease":false,"buyerPassAcceptanceTimeoutAutoRelease":true,"commercialValuationClaimed":false,"escrowAmountBaseUnits":5000000000000000,"fundingRequiredBeforeInspection":true,"fundingRule":"MSG_VALUE_MUST_EQUAL_ESCROW_AMOUNT_EXACTLY","fundsLockedDuringDisputeOrEscalation":true,"inspectorTimeoutAutoRefund":false,"inspectorTimeoutAutoRelease":false,"partialSettlement":"OUT_OF_MVP","reentrancyProtectionRequired":true,"settlementAsset":"NATIVE_SEPOLIA_ETH","settlementOutcomeEncoding":{"NONE":0,"REFUND_TO_BUYER":2,"RELEASE_TO_SUPPLIER":1},"unilateralAdminFundRedirection":false,"withdrawalPattern":"PULL_PAYMENT"},"stateRules":{"acceptancePendingBuyerAccept":"RELEASE_TO_SUPPLIER","acceptancePendingTimeout":"RELEASE_TO_SUPPLIER","backupInspectorTimeout":"ESCALATED_NO_AUTOMATIC_PAYOUT","buyerAdmissiblePass":"ACCEPTANCE_PENDING","buyerAdmissibleReview":"DISPUTED_PRIMARY","buyerInspectionInvalid":"BUYER_REINSPECTION","buyerNoInspectionTimeout":"BUYER_INSPECTION_TIMEOUT_NO_AUTOMATIC_PAYOUT","escalatedExit":"SUPPLIER_AND_BUYER_MUTUAL_RESOLUTION_ONLY","executionInconsistent":"EXECUTION_HOLD_NO_AUTOMATIC_PAYOUT","primaryInspectorDecision":"RELEASE_OR_REFUND","primaryInspectorTimeout":"DISPUTED_BACKUP","supplierAdmissiblePass":"AWAIT_BUYER","supplierAdmissibleReview":"SUPPLIER_HOLD","supplierInspectionInvalid":"SUPPLIER_REINSPECTION","supplierPreShipmentFailureOrSilence":"REFUND_ENTITLEMENT_TO_BUYER_NOT_DEFECT_JUDGMENT"},"status":"ACTIVE","trade":{"backupInspectorWallet":"0xeE9652D5F77ffee10aFeb7854E88f7B83bDAF7dd","buyerStationSigner":"0xD5acfa7301BD73FfcBb3f73705E4dA4a2548faab","buyerWallet":"0x5B52D3B71dD5B4637B828Fd2a0e8bC78346709eE","chainId":11155111,"escrowAmountBaseUnits":5000000000000000,"inspectorStationSigner":"0x0d9B5d1caf10e7E66AE1F63A4085387F707d092d","primaryInspectorWallet":"0xb60F55bC142a078781199C6a1689Bd7a86d4f6a8","settlementAsset":"NATIVE_SEPOLIA_ETH","supplierStationSigner":"0x02883F2C472E6d82B88373448E54a209C27A6779","supplierWallet":"0xaE7B8A9B15534829492F9449a67e83aAbd82E7BE","tradeId":"0xe021917ece6af29be9a02300cccfe293f484ba685721f49550a98da96d64c94c","verifyingContract":"0x270e3E8a53dC50A04f0d83b5b4ae9416EB42fFa9"},"versioning":{"activePolicyMutable":false,"materialChangeRequiresNewPolicyAndFreshAcceptance":true,"materialChangesInclude":["product-scope","model-bundle","capture-profile","threshold-or-score-schema","required-view-set","actor-or-station","inspector","retry-or-window-rule","settlement-rule"],"p